{
  "$schema": "https://json-schema.org/draft/2020-12/schema",
  "$id": "urn:tea:evaluate:schema:committed-probe",
  "title": "probes/P-NNN.probe.json",
  "description": "The authored subset of an eval-quality probe that an evaluation folder commits (AD-9). Runtime-owned fields (schemaVersion, lineage, systemId, the three attested digests, every evidence reference, rollbackVerified, and the qualification fields a mutation file owns) are refused by tea-evaluate check under their own rule, and the runtime writes the qualified probe into runs/ and baseline/. Identifier patterns are checked by their own rule against eval-quality's published patterns.",
  "type": "object",
  "additionalProperties": false,
  "required": ["probeId", "probeClass", "behaviorId", "expectedClean", "rationale", "defects", "qualification"],
  "$defs": {
    "Deployment": {
      "description": "One deployment of the target: the release it runs, how it reports that release, and where each HTTP interface of the registry answers.",
      "type": "object",
      "additionalProperties": false,
      "required": ["release", "report", "origins"],
      "properties": {
        "release": {
          "description": "The identifier of the release this deployment runs, as its adopter names it (a version, a tag, a build id). The qualified probe records its digest: the pre-fix one as artifactDigest, the post-fix one as fixCommitDigest; the pre-fix one names the arm historical:<release>. One path segment: a letter or digit, then letters, digits, '.', '_', '+' or '-'.",
          "type": "string",
          "maxLength": 128,
          "pattern": "^[A-Za-z0-9][A-Za-z0-9._+-]*$"
        },
        "report": {
          "description": "How the deployment reports its release: an operation of the contract's api interface and an RFC 6901 JSON pointer into the JSON body of its answer. Before either arm the runtime sends that request to each deployment through the evaluation's HTTP port, with no bound inputs, and refuses the probe when the string at the pointer is not the declared release. check requires the operation to be declared on an api interface of the contract that needs no input, and the pointer to be a JSON pointer (rule historical).",
          "type": "object",
          "additionalProperties": false,
          "required": ["operationId", "pointer"],
          "properties": {
            "operationId": { "type": "string", "minLength": 1 },
            "pointer": { "type": "string", "minLength": 1 }
          }
        },
        "origins": {
          "description": "The origin (scheme://host[:port], with no path, query, fragment or credentials) each HTTP interface of the registry answers at in this deployment, keyed by interface ID. check requires every HTTP interface of the registry and no other (rule historical); each origin must be one the registry's api policy authorizes, which eval-quality's evaluateTarget decides at run time.",
          "type": "object",
          "minProperties": 1,
          "additionalProperties": { "type": "string", "minLength": 1 }
        }
      }
    }
  },
  "properties": {
    "probeId": { "type": "string" },
    "probeClass": { "enum": ["defect", "gameability", "zero-action", "canary"] },
    "behaviorId": { "type": "string" },
    "expectedClean": { "type": "boolean" },
    "rationale": { "type": "string", "minLength": 1 },
    "defects": {
      "type": "array",
      "items": {
        "type": "object",
        "additionalProperties": false,
        "required": ["defectId", "behaviorId", "summary", "severity", "source", "manifestationWitness"],
        "properties": {
          "defectId": { "type": "string" },
          "behaviorId": { "type": "string" },
          "summary": { "type": "string", "minLength": 1 },
          "severity": { "enum": ["low", "material", "critical"] },
          "source": { "enum": ["natural", "controlled-mutation"] },
          "manifestationWitness": {
            "description": "Validated against eval-quality's published probe schema.",
            "type": ["object", "null"]
          }
        }
      }
    },
    "defectSignature": {
      "description": "Validated against eval-quality's published probe schema.",
      "type": "object"
    },
    "qualification": {
      "description": "The qualification route and the inputs its author supplies. The runtime adds the evidence the route demands.",
      "type": "object",
      "required": ["route"],
      "properties": {
        "route": { "enum": ["historical", "controlled-mutation", "gameability", "canary", "clean-control"] }
      },
      "allOf": [
        {
          "if": { "required": ["route"], "properties": { "route": { "const": "historical" } } },
          "then": {
            "additionalProperties": false,
            "required": ["route"],
            "properties": {
              "route": true,
              "fixCommit": {
                "description": "The worktree route: the commit that fixed the defect, as a hexadecimal commit id (7 to 40 lowercase hex digits, abbreviated or full), never a ref, which moves as history advances; the run records its full id. The pre-fix revision is its first parent. An id that names no commit in a repository with its full history is an authoring defect. A probe names exactly one of this and deployments (check rule historical).",
                "type": "string",
                "pattern": "^[0-9a-f]{7,40}$"
              },
              "deployments": {
                "description": "The deployment route, for a target reachable only as a remote deployment: the pre-fix and the post-fix deployment, both of which check requires (rule historical). The fail-before arm, the defect's manifestation-witness leg and the trials of the arm historical:<preFix.release> reach the pre-fix deployment, and the pass-after arm the post-fix one.",
                "type": "object",
                "additionalProperties": false,
                "properties": {
                  "preFix": { "$ref": "#/$defs/Deployment" },
                  "fix": { "$ref": "#/$defs/Deployment" }
                }
              }
            }
          }
        },
        {
          "if": { "required": ["route"], "properties": { "route": { "const": "controlled-mutation" } } },
          "then": {
            "additionalProperties": false,
            "required": ["route", "mutation"],
            "properties": {
              "route": true,
              "mutation": { "description": "The M-NNN identifier of a file under mutations/.", "type": "string" }
            }
          }
        },
        {
          "if": { "required": ["route"], "properties": { "route": { "const": "gameability" } } },
          "then": {
            "additionalProperties": false,
            "required": ["route", "degenerateResponse", "naiveOracle"],
            "properties": {
              "route": true,
              "degenerateResponse": {
                "description": "The degenerate response described in prose, as eval-quality keeps it; its bytes are committed at corpus/gameability/<probeId>.json.",
                "type": "string",
                "minLength": 1
              },
              "naiveOracle": {
                "description": "TeA's own field: the O-NNN identifier of an oracle of another behavior, which the degenerate response satisfies while the probe behavior's own oracle rejects it. It meets the oracle ID pattern eval-quality's contract schema publishes.",
                "type": "string",
                "pattern": "^O-[0-9]{3,}$"
              }
            }
          }
        },
        {
          "if": { "required": ["route"], "properties": { "route": { "const": "canary" } } },
          "then": {
            "additionalProperties": false,
            "required": ["route", "indicts"],
            "properties": { "route": true, "indicts": { "enum": ["corpus", "fixture"] } }
          }
        },
        {
          "if": { "required": ["route"], "properties": { "route": { "const": "clean-control" } } },
          "then": {
            "additionalProperties": false,
            "required": ["route", "noKnownDefectStatement"],
            "properties": { "route": true, "noKnownDefectStatement": { "type": "string", "minLength": 1 } }
          }
        }
      ]
    }
  }
}
