{
  "probeId": "P-002",
  "probeClass": "defect",
  "behaviorId": "B-002",
  "expectedClean": false,
  "rationale": "Seeded defect: the item rules omit required item pears.",
  "defects": [
    {
      "defectId": "D-001",
      "behaviorId": "B-002",
      "summary": "The summarizer omits required item pears.",
      "severity": "critical",
      "source": "controlled-mutation",
      "manifestationWitness": {
        "legId": "manifest-omitted-pears",
        "interfaceId": "summarizer",
        "operationId": "summarize",
        "inputs": {
          "argument": {},
          "option": {},
          "environment": {},
          "stdin": {
            "kind": "text",
            "value": "List pantry"
          }
        },
        "relation": {
          "op": "equality",
          "operands": [
            {
              "pointer": "/interactions/manifest-omitted-pears/stdout"
            },
            {
              "literal": "Summary for List pantry: apples\n"
            }
          ]
        }
      }
    }
  ],
  "defectSignature": {
    "interfaceKind": "cli",
    "invocation": {
      "executable": "summarizer",
      "subcommandPath": []
    },
    "observableChannel": "stdout",
    "condition": {
      "selector": {
        "inputBinding": {
          "path": null,
          "query": null,
          "header": null,
          "body": null,
          "argument": null,
          "option": null,
          "environment": null,
          "stdin": {
            "prompt": {
              "matcher": "any"
            }
          },
          "arguments": null
        }
      },
      "predicate": {
        "op": "equality",
        "operands": [
          {
            "pointer": "/interactions/observed/stdout"
          },
          {
            "literal": "Summary for List pantry: apples\n"
          }
        ]
      }
    }
  },
  "qualification": {
    "route": "controlled-mutation",
    "mutation": "M-001"
  }
}
