{
  "probeId": "P-001",
  "probeClass": "zero-action",
  "behaviorId": "B-001",
  "expectedClean": true,
  "rationale": "Clean control: under the committed strict policy the verdict command accepts the request.",
  "defects": [],
  "qualification": {
    "route": "clean-control",
    "noKnownDefectStatement": "The strict policy has no known defect."
  }
}
