{
  "probeId": "P-003",
  "probeClass": "defect",
  "behaviorId": "B-001",
  "expectedClean": false,
  "rationale": "[held-out] Seeded defect: M-002 gives exit 12 the evaluation weakness class, so Stage 11 sends an infrastructure failure to an evaluation repair.",
  "defects": [
    {
      "defectId": "D-002",
      "behaviorId": "B-001",
      "summary": "The exit table classes an infrastructure failure (exit 12) as an evaluation weakness.",
      "severity": "material",
      "source": "controlled-mutation",
      "manifestationWitness": {
        "legId": "manifest-exit-12",
        "interfaceId": "evaluate-skill",
        "operationId": "run-skill",
        "inputs": {
          "argument": {},
          "option": {
            "agent": "claude",
            "agent-arg": "--json-schema={\"type\":\"object\",\"properties\":{\"basis\":{\"type\":\"string\"},\"status\":{\"type\":\"string\",\"enum\":[\"answered\",\"refused\"]},\"exit11\":{\"type\":\"string\"},\"exit12\":{\"type\":\"string\"}},\"required\":[\"basis\",\"status\",\"exit11\",\"exit12\"],\"additionalProperties\":false}",
            "capability": "read-only",
            "model": "claude-sonnet-5",
            "skill-root": "skills/bmad-testarch-evaluate",
            "timeout-ms": "300000"
          },
          "environment": {},
          "stdin": {
            "kind": "text",
            "value": "Run only Stage 11 (Gaps) of this skill for the case below. Answer from the skill's own guides; do not run commands and do not write files.\n\nThe adopter reports two failed commands, each with no evidence artifact:\n1. `node cli/evaluate.js run --evaluation test/evaluations/example --partition development` exited 11.\n2. `node cli/evaluate.js preflight --evaluation test/evaluations/example` exited 12.\n\nFor each, find the AD-10 class the gaps guide assigns to that source and exit. Put any explanation in the object's basis field. Your entire reply must be exactly one JSON object on one line and nothing else: no text before or after it, no Markdown, no backticks and no code fence. It must parse with JSON.parse as written:\n{\"basis\": \"<one sentence naming the guide rows you used>\", \"status\": \"answered\", \"exit11\": \"<the class of the first command, as the guide names it>\", \"exit12\": \"<the class of the second command, as the guide names it>\"}\n"
          }
        },
        "relation": {
          "op": "equality",
          "operands": [
            {
              "pointer": "/interactions/manifest-exit-12/stdout/exit12"
            },
            {
              "literal": "evaluation weakness"
            }
          ]
        }
      }
    }
  ],
  "defectSignature": {
    "interfaceKind": "cli",
    "invocation": {
      "executable": "tea-skill-runner",
      "subcommandPath": []
    },
    "observableChannel": "stdout",
    "condition": {
      "selector": {
        "inputBinding": {
          "path": null,
          "query": null,
          "header": null,
          "body": null,
          "argument": null,
          "option": null,
          "environment": null,
          "stdin": {
            "prompt": {
              "literal": "Run only Stage 11 (Gaps) of this skill for the case below. Answer from the skill's own guides; do not run commands and do not write files.\n\nThe adopter reports two failed commands, each with no evidence artifact:\n1. `node cli/evaluate.js run --evaluation test/evaluations/example --partition development` exited 11.\n2. `node cli/evaluate.js preflight --evaluation test/evaluations/example` exited 12.\n\nFor each, find the AD-10 class the gaps guide assigns to that source and exit. Put any explanation in the object's basis field. Your entire reply must be exactly one JSON object on one line and nothing else: no text before or after it, no Markdown, no backticks and no code fence. It must parse with JSON.parse as written:\n{\"basis\": \"<one sentence naming the guide rows you used>\", \"status\": \"answered\", \"exit11\": \"<the class of the first command, as the guide names it>\", \"exit12\": \"<the class of the second command, as the guide names it>\"}\n"
            }
          },
          "arguments": null
        }
      },
      "predicate": {
        "op": "equality",
        "operands": [
          {
            "pointer": "/interactions/observed/stdout/exit12"
          },
          {
            "literal": "evaluation weakness"
          }
        ]
      }
    }
  },
  "qualification": {
    "route": "controlled-mutation",
    "mutation": "M-002"
  }
}
